{
 "card_id": "sc_ev20718_ctl",
 "card_type": "before-after",
 "phenomenon": {
  "description": "control site, no reported event",
  "status": "none-expected",
  "external_reference": null
 },
 "spatial": {
  "lat": -14.277634879289648,
  "lon": 133.92660599776343,
  "extent_m": 2240.0,
  "crs": "EPSG:4326"
 },
 "temporal": {
  "timestamps": [
   "2026-04-14",
   "2026-08-10"
  ],
  "reference_event_time": null
 },
 "evidence": [
  {
   "key": "band_means_before",
   "value": [
    0.03909210115671158,
    0.07044139504432678,
    0.07974497973918915,
    0.27585911750793457,
    0.2652343511581421,
    0.16278380155563354
   ],
   "units": "reflectance",
   "class": "observed",
   "source": "Sentinel-2 L2A COG (Earth Search STAC, earth-search.aws.element84.com)",
   "method": "windowed COG read, 6 HLS-equivalent bands, mean over 224x224 chip",
   "provenance": "S2A_53LLE_20260414_0_L2A",
   "uncertainty": {
    "type": "window-cloud-fraction",
    "value": 0.0
   }
  },
  {
   "key": "band_means_after",
   "value": [
    0.05407558009028435,
    0.07985062152147293,
    0.11483603715896606,
    0.2181711196899414,
    0.3158818185329437,
    0.22535645961761475
   ],
   "units": "reflectance",
   "class": "observed",
   "source": "Sentinel-2 L2A COG (Earth Search STAC, earth-search.aws.element84.com)",
   "method": "windowed COG read, 6 HLS-equivalent bands, mean over 224x224 chip",
   "provenance": "S2C_53LLE_20260810_0_L2A",
   "uncertainty": {
    "type": "window-cloud-fraction",
    "value": 0.0
   }
  },
  {
   "key": "ndvi_mean_before",
   "value": 0.5572584271430969,
   "units": null,
   "class": "computed",
   "source": "Sentinel-2 L2A COG (Earth Search STAC, earth-search.aws.element84.com)",
   "method": "NDVI=(NIR-Red)/(NIR+Red), chip mean",
   "provenance": "demonstrator/evidence.py",
   "uncertainty": null,
   "uncertainty_note": "no formal uncertainty model for this quantity in this demonstrator"
  },
  {
   "key": "ndvi_mean_after",
   "value": 0.3142528235912323,
   "units": null,
   "class": "computed",
   "source": "Sentinel-2 L2A COG (Earth Search STAC, earth-search.aws.element84.com)",
   "method": "NDVI=(NIR-Red)/(NIR+Red), chip mean",
   "provenance": "demonstrator/evidence.py",
   "uncertainty": null,
   "uncertainty_note": "no formal uncertainty model for this quantity in this demonstrator"
  },
  {
   "key": "nbr_mean_before",
   "value": 0.2621147632598877,
   "units": null,
   "class": "computed",
   "source": "Sentinel-2 L2A COG (Earth Search STAC, earth-search.aws.element84.com)",
   "method": "NBR=(NIR-SWIR2)/(NIR+SWIR2), chip mean",
   "provenance": "demonstrator/evidence.py",
   "uncertainty": null,
   "uncertainty_note": "no formal uncertainty model for this quantity in this demonstrator"
  },
  {
   "key": "nbr_mean_after",
   "value": -0.014077916741371155,
   "units": null,
   "class": "computed",
   "source": "Sentinel-2 L2A COG (Earth Search STAC, earth-search.aws.element84.com)",
   "method": "NBR=(NIR-SWIR2)/(NIR+SWIR2), chip mean",
   "provenance": "demonstrator/evidence.py",
   "uncertainty": null,
   "uncertainty_note": "no formal uncertainty model for this quantity in this demonstrator"
  },
  {
   "key": "delta_ndvi",
   "value": -0.24300560355186462,
   "units": null,
   "class": "computed",
   "source": "Sentinel-2 L2A COG (Earth Search STAC, earth-search.aws.element84.com)",
   "method": "after minus before chip-mean NDVI",
   "provenance": "demonstrator/evidence.py",
   "uncertainty": null,
   "uncertainty_note": "no formal uncertainty model for this quantity in this demonstrator"
  },
  {
   "key": "delta_nbr",
   "value": -0.27619268000125885,
   "units": null,
   "class": "computed",
   "source": "Sentinel-2 L2A COG (Earth Search STAC, earth-search.aws.element84.com)",
   "method": "after minus before chip-mean NBR",
   "provenance": "demonstrator/evidence.py",
   "uncertainty": null,
   "uncertainty_note": "no formal uncertainty model for this quantity in this demonstrator"
  },
  {
   "key": "repr_change_cosine_dist",
   "value": 0.014889299869537354,
   "units": null,
   "class": "learned-representation",
   "source": "Prithvi-EO-1.0-100M (ibm-nasa-geospatial, Apache-2.0)",
   "method": "1 - cosine(mean patch embedding before, after)",
   "provenance": "demonstrator/prithvi_embed.py",
   "uncertainty": null,
   "uncertainty_note": "no calibrated uncertainty for FM embedding distances; interpretation is relative to the control distribution"
  },
  {
   "key": "event_catalog_check",
   "value": "no EONET event reported at this location/date",
   "units": null,
   "class": "contextual",
   "source": "NASA EONET",
   "method": "spatio-temporal catalog join (negative result)",
   "provenance": "https://eonet.gsfc.nasa.gov/api/v3/events",
   "uncertainty": null,
   "uncertainty_note": "no formal uncertainty model for this quantity in this demonstrator"
  }
 ],
 "analogs": [
  {
   "ref": "ev21059_ctl",
   "similarity": 0.9901,
   "method": "cosine over Prithvi-EO-1.0-100M mean patch embeddings (after-scene)"
  },
  {
   "ref": "ev20718",
   "similarity": 0.9885,
   "method": "cosine over Prithvi-EO-1.0-100M mean patch embeddings (after-scene)"
  },
  {
   "ref": "ev20714_ctl",
   "similarity": 0.9819,
   "method": "cosine over Prithvi-EO-1.0-100M mean patch embeddings (after-scene)"
  }
 ],
 "relationships": [
  {
   "type": "control-for",
   "subject": "sc_ev20718_ctl",
   "object": "sc_ev20718"
  }
 ],
 "reasoning_affordances": [
  "compare",
  "describe",
  "detect",
  "hypothesize",
  "recommend-analysis",
  "retrieve-analogs",
  "test-hypotheses"
 ],
 "provenance": {
  "pipeline": "demonstrator/build_cards.py",
  "built_at_data_time": "2026-08-10",
  "notes": "repr-change control-derived threshold: 0.0629"
 },
 "insufficiencies": []
}