{
 "card_id": "sc_ev20581",
 "card_type": "before-after",
 "phenomenon": {
  "description": "Wildfire in Russian Federation 1028969",
  "status": "externally-reported",
  "external_reference": "https://eonet.gsfc.nasa.gov/api/v3/events/EONET_20581"
 },
 "spatial": {
  "lat": 59.62540210468415,
  "lon": 88.30098705677521,
  "extent_m": 2240.0,
  "crs": "EPSG:4326"
 },
 "temporal": {
  "timestamps": [
   "2026-01-23",
   "2026-09-13"
  ],
  "reference_event_time": "2026-06-09"
 },
 "evidence": [
  {
   "key": "band_means_before",
   "value": [
    0.33460715413093567,
    0.26620015501976013,
    0.26733487844467163,
    0.29873237013816833,
    0.06425514072179794,
    0.059751760214567184
   ],
   "units": "reflectance",
   "class": "observed",
   "source": "Sentinel-2 L2A COG (Earth Search STAC, earth-search.aws.element84.com)",
   "method": "windowed COG read, 6 HLS-equivalent bands, mean over 224x224 chip",
   "provenance": "S2C_45VWG_20260123_0_L2A",
   "uncertainty": {
    "type": "window-cloud-fraction",
    "value": 0.0
   }
  },
  {
   "key": "band_means_after",
   "value": [
    0.00609436584636569,
    0.02488013170659542,
    0.029804455116391182,
    0.13393324613571167,
    0.16065850853919983,
    0.11127378791570663
   ],
   "units": "reflectance",
   "class": "observed",
   "source": "Sentinel-2 L2A COG (Earth Search STAC, earth-search.aws.element84.com)",
   "method": "windowed COG read, 6 HLS-equivalent bands, mean over 224x224 chip",
   "provenance": "S2C_45VWG_20260913_0_L2A",
   "uncertainty": {
    "type": "window-cloud-fraction",
    "value": 0.0
   }
  },
  {
   "key": "ndvi_mean_before",
   "value": 0.05859433487057686,
   "units": null,
   "class": "computed",
   "source": "Sentinel-2 L2A COG (Earth Search STAC, earth-search.aws.element84.com)",
   "method": "NDVI=(NIR-Red)/(NIR+Red), chip mean",
   "provenance": "demonstrator/evidence.py",
   "uncertainty": null,
   "uncertainty_note": "no formal uncertainty model for this quantity in this demonstrator"
  },
  {
   "key": "ndvi_mean_after",
   "value": 0.6262094974517822,
   "units": null,
   "class": "computed",
   "source": "Sentinel-2 L2A COG (Earth Search STAC, earth-search.aws.element84.com)",
   "method": "NDVI=(NIR-Red)/(NIR+Red), chip mean",
   "provenance": "demonstrator/evidence.py",
   "uncertainty": null,
   "uncertainty_note": "no formal uncertainty model for this quantity in this demonstrator"
  },
  {
   "key": "nbr_mean_before",
   "value": 0.6685974597930908,
   "units": null,
   "class": "computed",
   "source": "Sentinel-2 L2A COG (Earth Search STAC, earth-search.aws.element84.com)",
   "method": "NBR=(NIR-SWIR2)/(NIR+SWIR2), chip mean",
   "provenance": "demonstrator/evidence.py",
   "uncertainty": null,
   "uncertainty_note": "no formal uncertainty model for this quantity in this demonstrator"
  },
  {
   "key": "nbr_mean_after",
   "value": 0.0738573968410492,
   "units": null,
   "class": "computed",
   "source": "Sentinel-2 L2A COG (Earth Search STAC, earth-search.aws.element84.com)",
   "method": "NBR=(NIR-SWIR2)/(NIR+SWIR2), chip mean",
   "provenance": "demonstrator/evidence.py",
   "uncertainty": null,
   "uncertainty_note": "no formal uncertainty model for this quantity in this demonstrator"
  },
  {
   "key": "delta_ndvi",
   "value": 0.5676151625812054,
   "units": null,
   "class": "computed",
   "source": "Sentinel-2 L2A COG (Earth Search STAC, earth-search.aws.element84.com)",
   "method": "after minus before chip-mean NDVI",
   "provenance": "demonstrator/evidence.py",
   "uncertainty": null,
   "uncertainty_note": "no formal uncertainty model for this quantity in this demonstrator"
  },
  {
   "key": "delta_nbr",
   "value": -0.5947400629520416,
   "units": null,
   "class": "computed",
   "source": "Sentinel-2 L2A COG (Earth Search STAC, earth-search.aws.element84.com)",
   "method": "after minus before chip-mean NBR",
   "provenance": "demonstrator/evidence.py",
   "uncertainty": null,
   "uncertainty_note": "no formal uncertainty model for this quantity in this demonstrator"
  },
  {
   "key": "repr_change_cosine_dist",
   "value": 0.17090803384780884,
   "units": null,
   "class": "learned-representation",
   "source": "Prithvi-EO-1.0-100M (ibm-nasa-geospatial, Apache-2.0)",
   "method": "1 - cosine(mean patch embedding before, after)",
   "provenance": "demonstrator/prithvi_embed.py",
   "uncertainty": null,
   "uncertainty_note": "no calibrated uncertainty for FM embedding distances; interpretation is relative to the control distribution"
  },
  {
   "key": "reported_event",
   "value": {
    "title": "Wildfire in Russian Federation 1028969",
    "date": "2026-06-09",
    "category": "wildfires"
   },
   "units": null,
   "class": "contextual",
   "source": "NASA EONET",
   "method": "spatio-temporal catalog join",
   "provenance": "https://eonet.gsfc.nasa.gov/api/v3/events/EONET_20581",
   "uncertainty": null,
   "uncertainty_note": "no formal uncertainty model for this quantity in this demonstrator"
  }
 ],
 "analogs": [
  {
   "ref": "ev21358",
   "similarity": 0.9813,
   "method": "cosine over Prithvi-EO-1.0-100M mean patch embeddings (after-scene)"
  },
  {
   "ref": "ev20767_ctl",
   "similarity": 0.9761,
   "method": "cosine over Prithvi-EO-1.0-100M mean patch embeddings (after-scene)"
  },
  {
   "ref": "ev21357",
   "similarity": 0.9731,
   "method": "cosine over Prithvi-EO-1.0-100M mean patch embeddings (after-scene)"
  }
 ],
 "relationships": [],
 "reasoning_affordances": [
  "compare",
  "describe",
  "detect",
  "discriminate",
  "explain",
  "integrate",
  "retrieve-analogs"
 ],
 "provenance": {
  "pipeline": "demonstrator/build_cards.py",
  "built_at_data_time": "2026-09-13",
  "notes": "repr-change control-derived threshold: 0.0629"
 },
 "insufficiencies": []
}